<!DOCTYPE radio SYSTEM "radio.dtd">
<radio name="cockpitSX (easy)" data_min="900" data_max="2100" sync_min ="5000" sync_max ="15000" pulse_type="POSITIVE">
 <channel ctl="D" function="ROLL"     min="2050" neutral="1500" max="950" average="0"/>
 <channel ctl="C" function="PITCH"    min="2050" neutral="1500" max="950" average="0"/>
 <channel ctl="B" function="YAW"      min="950" neutral="1500" max="2050" average="0"/>
 <channel ctl="A" function="THROTTLE" min="1223" neutral="1223" max="2050" average="0"/>
 <channel ctl="G" function="UNUSED"    min="2050" neutral="1500" max="950" average="1"/> <!-- center slider        -->
 <channel ctl="E" function="GAIN1"     min="2050" neutral="1496" max="948" average="1"/> <!-- top right slider     -->
 <channel ctl="PHAUX2" function="MODE"    min="2050" neutral="1500" max="948" average="1"/> <!-- Top right switch -->
</radio>
